[
  {
    "standard_functionality": "Accident / Breakdown / Roadside Support",
    "definition": "Support for incidents, breakdowns, recovery, roadside assistance or related operational disruption during the lease or fleet lifecycle.",
    "alternative_names": [
      "Roadside Assistance",
      "Breakdown and Recovery Management",
      "Accident Assistance",
      "Specialised Vehicle Support"
    ],
    "capability_category": "Operational Support",
    "maas_relevance": "Supports vehicle availability and service continuity, both of which are important for MaaS fleet reliability.",
    "notes": "Keep distinct from Insurance / Risk Support unless the evidence only refers to risk cover rather than incident response."
  },
  {
    "standard_functionality": "Commercial Vehicle Leasing",
    "definition": "Lease, rental, funding or support capability for commercial vehicles such as trucks, trailers, delivery vehicles, bakkies or logistics fleet assets.",
    "alternative_names": [
      "Commercial Vehicle Support",
      "Full Maintenance Truck Leasing",
      "Truck Leasing",
      "Commercial Vehicle Rental"
    ],
    "capability_category": "Vehicle Access",
    "maas_relevance": "Extends mobility supply beyond passenger vehicles into logistics, delivery and enterprise transport use cases.",
    "notes": "Use Commercial Vehicle Range when the evidence is primarily about breadth of available vehicle types rather than the leasing/support capability."
  },
  {
    "standard_functionality": "Commercial Vehicle Range",
    "definition": "Availability of a broad set of commercial vehicle types within the provider fleet or product offer.",
    "alternative_names": [
      "Commercial Fleet Range",
      "Truck and Trailer Range",
      "Mixed Commercial Fleet"
    ],
    "capability_category": "Vehicle Supply",
    "maas_relevance": "A broader vehicle range improves the fit between MaaS-adjacent services and different transport or logistics requirements.",
    "notes": "Represents vehicle choice breadth; it does not by itself confirm leasing, finance or lifecycle services."
  },
  {
    "standard_functionality": "Contract Term / Mileage Structuring",
    "definition": "Ability to define lease duration, mileage, utilisation or repayment terms as part of the customer agreement.",
    "alternative_names": [
      "Lease Term Structuring",
      "Mileage Structuring",
      "Flexible Repayment Terms",
      "Fixed Period and Distance"
    ],
    "capability_category": "Contract Structuring",
    "maas_relevance": "Term and utilisation parameters help align asset supply with demand patterns, usage intensity and fleet planning.",
    "notes": "Keep distinct from Needs-Based Lease Customisation where the evidence refers to broader tailoring of operating conditions or solution design."
  },
  {
    "standard_functionality": "Driver / Owner-Operator Enablement",
    "definition": "Programmes that enable drivers or owner-operators to access vehicles or participate in transport operations through a structured leasing or subscription model.",
    "alternative_names": [
      "Owner-Operator Programme",
      "Driver Enablement",
      "Subscription-Based Owner-Operator Programme"
    ],
    "capability_category": "Operator Enablement",
    "maas_relevance": "Can expand the supply base for mobility or logistics networks by enabling operators rather than only financing fleet owners.",
    "notes": "Keep distinct from Driver Management / Behaviour, which concerns managing active driver performance."
  },
  {
    "standard_functionality": "Driver Management / Behaviour",
    "definition": "Tools or services that monitor, manage or improve driver behaviour, performance or driver-related fleet operations.",
    "alternative_names": [
      "Driver Behaviour",
      "Driver Solutions",
      "Driver Performance Management"
    ],
    "capability_category": "Fleet Operations",
    "maas_relevance": "Driver behaviour affects safety, cost, uptime and customer experience in managed mobility fleets.",
    "notes": "Evidence may be based on data collection or named driver solutions; classify conservatively where service depth is unclear."
  },
  {
    "standard_functionality": "Fixed Monthly Cost / Rental",
    "definition": "A predictable monthly rental or payment structure for vehicle use, often covering a fixed period, mileage or service bundle.",
    "alternative_names": [
      "Fixed Monthly Rental",
      "Predictable Monthly Cost",
      "Budgeting Certainty",
      "Fixed Payments"
    ],
    "capability_category": "Commercial Model",
    "maas_relevance": "Predictable asset costs support MaaS pricing, margin control and budget planning.",
    "notes": "Does not automatically imply full maintenance unless maintenance is separately evidenced."
  },
  {
    "standard_functionality": "Fleet Administration",
    "definition": "Administrative support for managing fleet records, processes, compliance, service coordination or related back-office fleet activities.",
    "alternative_names": [
      "Fleet Admin",
      "Fleet Administration Services",
      "Fleet Back-Office Support"
    ],
    "capability_category": "Fleet Operations",
    "maas_relevance": "Administration capability helps scale fleet operations and reduces manual burden in multi-vehicle services.",
    "notes": "Keep distinct from Fleet Management when the evidence specifically names administration rather than an end-to-end management proposition."
  },
  {
    "standard_functionality": "Fleet Data / Reporting",
    "definition": "Collection, analysis or reporting of fleet data such as vehicle condition, fuel, tyres, driver behaviour or operational metrics.",
    "alternative_names": [
      "Fleet Reporting",
      "Fleet Analytics",
      "Fleet Data Analysis",
      "Operational Reporting"
    ],
    "capability_category": "Data and Reporting",
    "maas_relevance": "Fleet data supports optimisation, governance and performance management for MaaS operations.",
    "notes": "Keep distinct from Vehicle Tracking / Telematics when the evidence is about reporting outputs rather than live location or telemetry."
  },
  {
    "standard_functionality": "Fleet Management",
    "definition": "Management of fleet operations or the vehicle lifecycle, potentially including procurement, maintenance, administration, risk, reporting and service coordination.",
    "alternative_names": [
      "Fleet Solutions",
      "Fleet Managed Solutions",
      "Fleet Management Services",
      "End-to-End Fleet Management"
    ],
    "capability_category": "Fleet Operations",
    "maas_relevance": "Fleet management is a core operating capability for placing, maintaining and coordinating vehicle supply within a MaaS ecosystem.",
    "notes": "Use more specific capabilities where the evidence identifies a concrete sub-capability such as maintenance, procurement or reporting."
  },
  {
    "standard_functionality": "Fuel Management",
    "definition": "Fuel-related services, optimisation, cost control, data capture or administration for vehicles or fleets.",
    "alternative_names": [
      "Fuel Solutions",
      "Fuel Optimisation",
      "Fuel Cost Management",
      "Fuel Services"
    ],
    "capability_category": "Operating Cost Management",
    "maas_relevance": "Fuel or energy cost control is important for unit economics in usage-based mobility operations.",
    "notes": "Public evidence may not always specify whether the service includes cards, billing, controls or reporting."
  },
  {
    "standard_functionality": "Full Maintenance Lease / Rental",
    "definition": "A lease or rental product that bundles vehicle use with maintenance responsibilities over an agreed term or mileage.",
    "alternative_names": [
      "Full Maintenance Lease",
      "Full Maintenance Rental",
      "Full Maintenance Leasing",
      "FML"
    ],
    "capability_category": "Vehicle Access",
    "maas_relevance": "Bundles asset access with operational readiness, reducing lifecycle complexity for MaaS fleet deployment.",
    "notes": "Keep distinct from Maintenance Management, which is the underlying maintenance service capability."
  },
  {
    "standard_functionality": "Insurance / Risk Support",
    "definition": "Insurance, risk assistance or related support attached to financed, leased or managed vehicles.",
    "alternative_names": [
      "Insurance",
      "Risk Support",
      "Comprehensive Vehicle Insurance",
      "Insurance Assistance"
    ],
    "capability_category": "Risk Management",
    "maas_relevance": "Risk support helps protect vehicle assets and reduce operational exposure in mobility services.",
    "notes": "Keep distinct from Residual Value / Ownership Risk Transfer, which concerns asset ownership and end-of-contract value risk."
  },
  {
    "standard_functionality": "Lease-to-Own",
    "definition": "A lease structure that gives the customer an option or pathway to buy the vehicle or asset at the end of the agreement.",
    "alternative_names": [
      "Lease to Own",
      "Option to Buy",
      "Dynamic Lease",
      "Purchase Option"
    ],
    "capability_category": "Commercial Model",
    "maas_relevance": "Ownership pathways may support driver, operator or partner acquisition models in mobility ecosystems.",
    "notes": "Keep distinct from Operating Lease / Rental where no ownership pathway is evidenced."
  },
  {
    "standard_functionality": "Licensing / Registration Support",
    "definition": "Support for vehicle licensing, registration, licence renewal or related compliance administration.",
    "alternative_names": [
      "Licence Renewal",
      "Licence and Registration Solutions",
      "Registration Support",
      "Vehicle Licensing"
    ],
    "capability_category": "Compliance Administration",
    "maas_relevance": "Compliance administration helps keep vehicles legally available for service in managed fleets.",